analysis_finding,mechanism,model_terms,tested_configs,outcome_interpretation
VT/VF boundary samples concentrate dangerous errors.,Boundary-risk weighting,boundary_ce_weight,boundary075; boundary075_center; boundary100_center; boundary075_prototype,"Boundary weighting improves total errors, but boundary075 alone only weakly reduces VT/VF cross-errors; it is not sufficient as the final mechanism."
Embedding neighborhoods are mixed and same-class samples are dispersed.,Prototype-center compactness,prototype_center_weight,proto_center_only; proto_center_margin; boundary075_center; boundary075_prototype,This is the strongest minimal mechanism: proto_center_only improves all six outcomes in 3/3 paired seeds.
VT/VF prototype ambiguity suggests insufficient inter-class separation.,VT/VF prototype margin,prototype_margin_weight + prototype_vtvf_margin,proto_margin_only; proto_center_margin; boundary075_margin; boundary075_prototype,"Margin alone is weak; it can help in combination, but should not be treated as a standalone core explanation."
Local purity and VT/VF neighborhood mixing are associated with outcome changes.,Contrastive local-purity control,contrastive_weight + contrastive boundary/negative anchors,boundary075_contrastive,Fails the guard in this search because VT/VF cross-errors increase despite some overall improvement.
Calibration and confident-risk mismatch remain visible in the uncertainty analysis.,Entropy / anti-confident risk calibration,risk_entropy_weight + anti_confident_risk_weight,boundary075_center_calibrated,Does not pass the guard: calibration add-ons do not justify inclusion when VT/VF safety outcomes degrade.
Waveform regularity and signal morphology are useful diagnostic evidence.,Regularity / waveform evidence,regularity auxiliary losses or routing evidence,not retained in this 36-run final candidate set,"Kept as diagnostic/recover evidence, not as the selected model-layer training constraint."
